{
  "SchemaVersion": 1,
  "ArtifactKind": "canonical-recovery-plan",
  "Metadata": {
    "CreatedAtUtc": "2026-08-12T00:00:00.0000000Z",
    "Generator": "scripts/recover-canonical-transaction.ps1",
    "RepositoryCommit": "1111111111111111111111111111111111111111"
  },
  "PlanPayload": {
    "SchemaVersion": 1,
    "PlanKind": "canonical-recover-abandon",
    "PlannedAction": "abandon",
    "RepoRoot": "C:\\fixture\\repo",
    "GitCommonDirHash": "1111111111111111111111111111111111111111111111111111111111111111",
    "RepositoryCommit": "1111111111111111111111111111111111111111",
    "ToolchainPolicyHash": "2222222222222222222222222222222222222222222222222222222222222222",
    "TransactionId": "11111111-1111-1111-1111-111111111111",
    "SourceWorktreeId": "3333333333333333333333333333333333333333333333333333333333333333",
    "TransactionNamespace": "C:\\fixture\\git\\canonical-transactions\\tx",
    "CanonicalOperationKind": "normalize",
    "OriginalDocumentHash": "4444444444444444444444444444444444444444444444444444444444444444",
    "OriginalPlanHash": "5555555555555555555555555555555555555555555555555555555555555555",
    "HeaderHash": "6666666666666666666666666666666666666666666666666666666666666666",
    "DerivedJournalHeadHash": "6666666666666666666666666666666666666666666666666666666666666666",
    "RecordChainHash": "7777777777777777777777777777777777777777777777777777777777777777",
    "PendingInventory": [],
    "WorkspaceInventory": [],
    "ResultState": { "State": "MISSING" },
    "Targets": [],
    "ConsumedDocumentHashes": ["4444444444444444444444444444444444444444444444444444444444444444"],
    "CurrentContextHash": "8888888888888888888888888888888888888888888888888888888888888888",
    "ExpectedOutcome": "abandoned",
    "ExpectedTerminalProjection": { "Outcome": "abandoned" },
    "ExpectedTerminalProjectionHash": "9999999999999999999999999999999999999999999999999999999999999999"
  },
  "PlanHash": "64ce0b8d71dae7f45639849cf237e1e13e2e4d820c659dfcc88625172712c623",
  "DocumentHash": "b49bc9fcc01d87152d0a7489424671b90d69590c6159dd5c041db6309d8a71f3"
}
